subject,tags,rating,votes,ratings,原名,发售日期,碟片数量,艺术家,价格,作曲,播放时长,厂牌,编曲,作词,版本特性,录音,别名,发行商,中文名,插图,制作人,商品编号,介质,英文名,Conductor,编号,Piano,Keyboard,Drums,Band,Choir,Orchestra,Arrangement,Sound Director,官方网站,原作,ASIN,发布,制作,条型码,品番
20,SoundHorizon 神作 Chronicle2nd Aramary REVO神 revo SH 恨不能打更高分 SH最高作 2004 Sound_Horizon 同人音乐 ~~ 同人 霜月はるか 史诗 Sound.Horizon 伪中庸 2004年3月 物语音乐 叙事史诗组曲 物語音楽 あらまり 040319 Sound·Horizon 中世纪 Renew 物语 Chronicle JIMANG,8.878,433,"['166', '125', '90', '34', '13', '3', '2', '0', '0', '0']",Chronicle 2nd,2004-03-19,1,Sound Horizon、Aramary、Jimang,,Revo,71 min,,,,专辑,,,,,Yokoyan,,,,,,,,,,,,,,,,,,,,,
15008,OST ARIA 治愈 钢琴 窪田ミナ 笹子重治 anime Hi-Res 妹尾武 2006 Image_Song 印象曲 水星领航员 2006年,9.110,82,"['39', '20', '18', '4', '0', '1', '0', '0', '0', '0']",ARIA ～ピアノ・コレクション～ スタジオーネ －季節－,2006-8-2,1,窪田ミナ、妹尾武,"￥ 2,100",笹子重治,36分,フライングドッグ,,,Soundtrack,flying DOG,,,,,,,,,,,,,,,,,,,,,,,,,
1802,岡崎律子 交响乐之雨 OST 冈崎律子 galgame 治愈 游戏原声带 2004 ボーカルアルバム「RAINBOW」 2004年 原声 游戏 シンフォニックレイン Main_Theme 合集 GAL 笠原弘子,8.926,203,"['62', '85', '44', '9', '1', '1', '0', '0', '0', '1']",シンフォニックレイン ボーカルアルバム「RAINBOW」,2004/5/26,1,折笠富美子、浅野真澄、中原麻衣、笠原弘子,"￥ 3,000",安部潤、岡崎律子,44 分,キングレコード,十川ともじ、西脇辰弥、磯江俊道、長谷川智樹、光宗信吉,岡崎律子,Soundtrack,キングレコード,交响乐之雨 声乐集「RAINBOW」,,,,,,,,,,,,,,,,,,,,,,,,
32707,OST ARIA 治愈 牧野由依 2009 笹子重治 广桥凉 anime Hi-Res ACG Collection 陪伴我度过大一 补 2009年 插入曲 印象曲 ED 插入歌 斋藤千和 水星领航员 公主,9.210,62,"['30', '17', '13', '2', '0', '0', '0', '0', '0', '0']",ARIA The NATURAL ボーカルソング・コレクション,2009-07-22,,TVサントラ、笹子重治,"￥ 3,045",Choro Club,51 m,,,,,flying DOG,,flying DOG,水星领航员第二季音乐精选集,,,,,,,,,,,,,,,,,,,,,,
19047,光宗信吉 OST 少女革命 杉并儿童合唱团 少女革命ウテナ 2008 J.A.SEAZER 东京混声合唱团 草尾毅 动漫ost anime KINGRECORDS.CO. LTD(K)(M) 音乐总集 2008年 アニメ OP ED,9.049,103,"['39', '36', '22', '6', '0', '0', '0', '0', '0', '0']",少女革命ウテナ コンプリートCD-BOX,2008年08月27日,10,奥井雅美、裕未瑠華、杉並児童合唱団、Maki Kamiya、幾原邦彦、光宗信吉、東京混声合唱団、田中耕作、大月俊倫、Shingo Kaneko、演劇実験室万有引力、NHK東京放送児童合唱団、Hideto Amari、ロイヤルナイツ、Roko Kinjou、子安武人、三石琴乃、久川綾、草尾毅、渕崎ゆり子、小杉十郎太、川上とも子、こおろぎさとみ、さいとうちほ、本多知恵子、佐々木望、KaNNa、村石有香、藤陵雅裕、高尾直樹,12600円(税込),光宗信吉、J・A・シーザー、新井理生、矢吹俊郎、中村八大、いずみたく、Sholom Secunda、及川光博,576 m,,矢吹俊郎、光宗信吉、平間あきひこ、Hideki Hagiwara、J・A・シーザー、Hideto Amari,奥井雅美、J・A・シーザー、藤林聖子、永六輔、山上路夫、安井かずみ、三ツ矢雄二、Be-PaPas,Box set / Limited Edition / Original recording remastered / Soundtrack,"KINGRECORDS.CO.,LTD(K)(M)",,"KINGRECORDS.CO.,LTD(K)(M)",少女革命原声集 Complete CD-BOX,,,,,,,,,,,,,,,,,,,,,,
178262,水月陵 OST 恋×シンアイ彼女 galgame 神曲 2016 2016年3月 DUCA 2016-03 flower AVG,8.953,150,"['48', '57', '35', '10', '0', '0', '0', '0', '0', '0']",恋×シンアイ彼女 Complete Sound Track,2016-03-31,2,Duca / yuiko,"￥3,564 [Book]",水月陵 / 宮崎京一 / Meis Clauson,81 分,Us:track,宮崎京一 / Meis Clauson,Duca / yuiko,,,,,,,,,,,,,,,,,,,,,,,,,,,
64103,K-ON! OST CD.BOX 2013 百石元 日笠陽子 豊崎愛生 佐藤聡美 寿美菜子 竹達彩奈 けいおん！ 动画 キャラソン 放課後ティータイム 前澤寛之 V.A. Collection 桜高軽音部 2016 堀口悠纪子 藤東知夏 まんがタイムきらら 永田依子 真田アサミ OP ED anime 轻音 插入曲 k-on,8.931,160,"['57', '59', '33', '8', '0', '0', '1', '1', '0', '1']",K-ON! MUSIC HISTORY'S BOX,2013-03-20,12,桜高軽音部（平沢唯、秋山澪、田井中律、琴吹紬（豊崎愛生、日笠陽子、佐藤聡美、寿美菜子））、放課後ティータイム（平沢唯、秋山澪、田井中律、琴吹紬、中野梓（豊崎愛生、日笠陽子、佐藤聡美、寿美菜子、竹達彩奈））、平沢憂（米澤円）、真鍋和（藤東知夏）、鈴木純（永田依子）、山中さわ子（真田アサミ）、河口紀美（浅川悠）,"￥ 19,800",Tom-H@ck、百石元、小森茂生、前澤寛之、ビーチェ、岡ナオキ、田村信二、村井邦彦、藤末樹、中山晋平、納所弁次郎,,ポニーキャニオン,Tom-H@ck、百石元、小森茂生、前澤寛之、ビーチェ、岡ナオキ,大森祥子、かきふらい、山上路夫、稲葉エミ、KANATA(中村彼方)、Nadia(SAWA)、hotaru、北原白秋、石原和三郎,Box set,ポニーキャニオン,,ポニーキャニオン,,,,,,,,,,,,,,,,,,,,,,,
194829,Suara うたわれるもの OST 2016 VOCAL 版权受限（呕） GAME,9.096,73,"['30', '24', '15', '4', '0', '0', '0', '0', '0', '0']",うたわれるもの 偽りの仮面&二人の白皇 歌集,2016-11-09,2,Suara,"￥4,104",衣笠道雄 / 松岡純也 / 下川直哉 / 中上和英,,F.I.X. Records,衣笠道雄 / 松岡純也 / 小林俊太郎 / Eric Gorfain / 豆田将,須谷尚子 / 巽明子(Suara),Limited Edition,,,,,,,,,,,,,,,,,,,,,,,,,,
198683,OST 目黒将司 2017 PERSONA ペルソナ5 游戏原声 游戏 PS4 2017年 迷の中毒性 女神异闻录 女神転生 待购 补 GAME cd 目黑将司 VGM 熱血,8.895,191,"['52', '83', '42', '12', '2', '0', '0', '0', '0', '0']",PERSONA5 ORIGINAL SOUNDTRACK,2017-01-17,3,Lyn,"￥ 4,320",目黒将司、小西利樹、小塚良太、喜多條敦志、土屋憲一,,ハピネット,目黒将司、小西利樹、小塚良太、喜多條敦志、土屋憲一,,Soundtracks,,『ペルソナ5』オリジナル・サウンドトラック,ハピネット,,,,,,,,,,,,,,,,,,,,,,,
21004,OST 下村阳子 光田康典 ACE+ 清田爱未 清田愛未 高橋哲哉 下村陽子 2010 Xeno ゼノシリーズ GAME ゲーム RPG 游戏音乐,9.108,65,"['29', '20', '12', '2', '2', '0', '0', '0', '0', '0']",Xenoblade Original Soundtrack,2010-06-23,,Sarah Lim,"￥ 3,500",下村陽子、ACE+(平松建治、工藤ともり、CHiCO)、清田愛未、光田康典,,,下村陽子、ACE+(平松建治、工藤ともり、CHiCO)、清田愛未、光田康典、成田勤、亀岡夏海,,,SMD,,SMD,异度之刃 游戏原声集,,,,,,,,,,,,,,,,,,,,,,
8845,灌篮高手 ED 经典 WANDS 1994 SLAMDUNK 燃曲 燃 single anime アニメ 8cm 动画 1994年 童年 柴崎浩 无 动画歌曲 OP_ED 葉山たけし TV ACG OPED 动漫主题曲 艺人专辑 織田哲郎,8.855,214,"['64', '83', '45', '20', '0', '0', '2', '0', '0', '0']",世界が終るまでは…,1994-06-08,1,WANDS,￥ 948,織田哲郎 / 柴崎浩,10 分,B-Gram RECORDS,葉山たけし / WANDS,上杉昇,Single,,,B-Gram RECORDS,直到世界尽头,,,,,,,,,,,,,,,,,,,,,,
2069,EVA 高桥洋子 神曲 勇敢的少年阿快去创造奇迹 经典 OP EVA神作 高橋洋子 1995 起床曲 anime 破 小时候 アニメ 动画 ER single 大森俊之 佐藤英敏 残酷な天使のテーゼ jkljk 童年 及川眠子 1995年 111 勇敢的少年阿快去创造JJ アニソン 中庸 无 OP_ED,8.769,1101,"['304', '424', '239', '101', '25', '5', '0', '1', '0', '2']",残酷な天使のテーゼ,1995-10-25,1,高橋洋子,"￥1,000",佐藤英敏 / 大森俊之,20 分,STAR CHILD,大森俊之,及川眠子,Single,,,STAR CHILD,残酷天使的行动纲领,,,,,,,,,,,,,,,,,,,,,,
163165,galgame 松本文纪 はな サクラノ詩 2015 OP OST monet 橋本みゆき 樱之诗 ACG 松本文紀 音乐专辑 ED Blasterhead 2015年 「✔」 SCA-自 ピクセルビー 钢琴 神曲 ADV EP うさ GAME,8.904,146,"['51', '47', '32', '15', '1', '0', '0', '0', '0', '0']",サクラノ詩 ヴォーカルCD,2015-12-27,1,はな(うさ) / 橋本みゆき / monet,"￥2,500",松本文紀 / Blasterhead / ピクセルビー,,枕,松本文紀 / Blasterhead / ピクセルビー,すかぢ(SCA-自) / 御空希色,,,,,,,,,,,,,,,,,,,,,,,,,,,
55452,Falcom 空之轨迹 ED 英雄传说 空の軌跡 2004 主题曲 游戏音乐 GAME 游戏 TM single RPG Main_Theme 2004年 轨迹系列 う～み VOCAL G.T.S,8.897,145,"['46', '51', '37', '9', '2', '0', '0', '0', '0', '0']",英雄伝説VI 空の軌跡 テーマソング「星の在り処」,2004.6.24,1,,,,5：59,,,,,,THE LEGEND OF HEROES VI SORA NO KISEKI THEME SONG,,星之所在,,,,,,,,,,,,,,,,,,,,,,
43522,燃 galgame OP JAM 未来への咆哮 マブラヴ JAM_Project 須藤賢一 河野陽吾 补 影山ヒロノブ 游戏 遠藤正明 JamProject 2005 ランティス,9.234,47,"['24', '16', '3', '3', '0', '1', '0', '0', '0', '0']",『マブラヴ オルタネイティヴ』 Insertion song Collection,2005-05-25,1,JAM Project、遠藤正明、影山ヒロノブ、福山芳樹,"￥ 1,500",,34 m,ランティス,須藤賢一,,Single / Maxi / Soundtrack,ランティス,『マブラヴ　オルタネイティヴ』　Insertion song Collection　「未来への咆哮」/「翼」/「Carry on」,,,,,,,,,,,,,,,,,,,,,,,,
43385,leaf OST WA2 上原れな galgame 白色相簿 2012 OP aquaplus 下川直哉 白学 GAME 游戏 2012年 ゲーム 白色相簿2 衣笠道雄 石川真也 津田朱里 white_album 中上和英 实体盘 上原玲奈 冬季音乐 米泽圆 神曲 cc AVG 松岡純也 WHITEALBUM,8.785,302,"['84', '115', '74', '19', '7', '2', '0', '0', '0', '1']",WHITE ALBUM 2 ORIGINAL SOUNDTRACK ～closing～,2012-6-29,2,上原れな,"￥ 3,000",下川直哉,,アクアプラス,,須谷尚子、下川直哉,OST,Leaf,,,,,,,,,,,,,,,,,,,,,,,,,
8459,岡崎律子 OST ピアノとチェロのための二重奏 长谷川智树 原声 美野春樹 岩永知樹 2005 冈崎律子 2005年 symphonic Rain galgame 游戏 GAME 2011 長谷川智樹 2011-,8.977,87,"['29', '33', '19', '6', '0', '0', '0', '0', '0', '0']",symphonic rain ピアノとチェロのための二重奏,2005-06-24,1,岡崎律子,9240 JPY (Package Price),岡崎律子,18:04,,美野春樹、長谷川智樹、岩永知樹,,"Original Soundtrack, Arrangement",KOGADO STUDIO,交响乐之雨钢琴与大提琴二重奏,,,しろ,,,,,,,,,,,,,,,,,,,,,
157648,OST 水星领航员 ED ARIA 2009 2009年 OP IN anime 音乐总集 我眼里怎么突然进沙子了,9.227,44,"['22', '12', '9', '0', '1', '0', '0', '0', '0', '0']",ARIA The BOX,2009/9/23,3,,,Choro Club,,,,,,163分,,,,,,,,,,,,,,,,,,,,,,,,,
280853,忍 OST Favorite 佐咲紗花 galgame eufonius 轮回 菊地創 2019年 童话风 2019 神曲 耐聽 AVG 游戏,9.013,75,"['29', '26', '15', '2', '3', '0', '0', '0', '0', '0']","さくら、もゆ。-as the Night's, Reincarnation- ミュージックコレクション",2019年4月29日（character1 2019）,4,佐咲紗花 / 山本美禰子 / 夏和小（藤田茜） / 鈴湯 / eufonius,"6,264(税込)",忍 / 石倉誉之 / 小高光太郎 / 野崎心平 / 菊地創,,FAVORITE,忍 / 石倉誉之 / 小高光太郎 / 野崎心平 / 菊地創,山本美禰子 / 漆原雪人 / riya,Original Soundtrack,,"Sakura, Moyu. -As the Night's, Reincarnation- Music Collection",,,,,,,,,,,,,,,,,,,,,,,,
8089,OST 久石让 天空之城 吉卜力 久石譲 宫崎骏 动漫电影原声带 2004 井上あずみ 神曲 杉並児童合唱団 动画 1986 anime StudioGhibliRecords 动画歌曲 アニメ 杉并儿童合唱团,8.877,130,"['34', '57', '29', '9', '1', '0', '0', '0', '0', '0']",天空の城ラピュタ サウンドトラック 飛行石の謎,1986-08-15,1,杉並児童合唱団、井上あずみ,"￥ 2,500",久石譲,39 m,徳間ジャパンコミュニケーションズ,久石譲,宮崎駿,Soundtrack,徳間ジャパンコミュニケーションズ,天空之城 原声,徳間ジャパンコミュニケーションズ,,,,,Audio CD,,,,,,,,,,,,,,,,,,
15164,OST 鷺巣詩郎 EVA 鹭巢诗郎 新世紀エヴァンゲリオン劇場版 ARIANNE 1997 anime LOREN&MASH bach 动画 ROBO LOREN Martin_Lascelles キングレコード 怀旧 日本 アニメ TV 新世紀エヴァンゲリオン 庵野秀明,8.880,133,"['51', '39', '31', '6', '4', '1', '0', '0', '0', '1']",THE END OF EVANGELION ― 新世紀エヴァンゲリオン 劇場版,1997-9-26,1,ARIANNE、LOREN & MASH,"￥ 3,059",鷺巣詩郎、Johann Sebastian Bach、Johann Schop,57 分,キングレコード,鷺巣詩郎、Myra Hess,MASH、庵野秀明、Mike Wyzgowski,,キングレコード,,キングレコード,《新世纪福音战士剧场版：THE END OF EVANGELION》原声音乐,,,,,,,,,,,,,,,,,,,,,,
242541,OST 牛尾憲輔 松田彬人 莉兹与青鸟 2018 牛尾宪辅 anime 京都アニメーション Lantis 2018年 映画 剧场版 ACG 动画 治愈 cd ランティス ambient,8.813,193,"['54', '67', '58', '11', '2', '1', '0', '0', '0', '0']","girls,dance,staircase",2018-04-25,2,小野豊,"￥3,780",牛尾憲輔 / 松田彬人,104 分,ランティス,牛尾憲輔 / 松田彬人 / 黒田賢一,山田尚子,Soundtrack,MARUNI STUDIO / Sound City Studio / VICTOR STUDIO,映画『リズと青い鳥』オリジナルサウンドトラック,,,,,,,,,,,,,,,,,,,,,,,,
4359,雪野五月 ひぐらしのなく頃に解 寒蝉鸣泣之时 ED You 治愈 神曲 寒蝉 dai 2007 ACG ひぐらしのなく頃に 文艺 动画 GAME single 单曲 平静 アニメ YOU必須死 不懂 艺人专辑 cd 声优曲 动画歌曲 OP_ED 动画原声 2007年 ゲーム VOCAL,8.737,536,"['128', '213', '140', '41', '9', '5', '0', '0', '0', '0']",YOU,2007-08-17,1,ゆきのさつき(雪野五月),,dai,,,,,单曲,,ひぐらしのなく頃に解　目明し編 / 蝉鸣之时解目明し編,,,,,,,,,,,,,,,,,,,,,,,,
4578,坂本真綾 菅野洋子 OP 罗德岛 罗德斯岛战记 1998 菅野よう子 坂本真绫 ロードス島戦記-英雄騎士伝- anime single 动漫 ACG 8cm 日本 上甘岭老湿 1998年 动画歌曲 OP_ED 中庸 アニメ j-pop JPOP OPED OST 动漫主题曲 VICTOR,8.835,164,"['50', '54', '45', '14', '0', '1', '0', '0', '0', '0']",奇跡の海,1998-04-22,1,坂本真綾,,菅野よう子,17 分,ビクターエンタテインメント,菅野よう子,岩里祐穂,,,TVアニメ『ロードス島戦記-英雄騎士伝-』オープニングテーマ,,奇迹之海,,,,,,,,,,,,,,,,,,,,,,
4316,OST Narcissu 水仙 催泪 galgame 水月陵 ElementsGarden ゲーム 2005 O.S.T. 游戏 Soundtrack riya pop Elements_Garden REM 瑞田茉莉 SENTIVE 猫野こめっと 2005年 矢野雅士 Ebi 上松範康 アニメ AVG nekoneko系 GAL Masa,8.784,255,"['56', '106', '76', '16', '1', '0', '0', '0', '0', '0']",Narcissu Soundtrack,2005年12月31日,1,riya,,Dreaming Rabbit,,,,,,,绝望的回忆,,水仙 原声集,,,,,,,,,,,,,,,,,,,,,,
255661,少女☆歌劇 插入歌 藤澤慶昌 anime 中村康隆 2018年 2018 歌剧 スタァライト九九組 IN 石井健太郎 ED OST 百合 插入曲 UiNA 波丽佳音 2018_8_22 版权受限（呕） MA 尋木ヒロ 战斗 10 VA 挿入歌 VOCAL ACG cd 动画 专辑,8.801,206,"['47', '87', '58', '12', '2', '0', '0', '0', '0', '0']",ラ レヴュー ド マチネ,2018-08-22,1,スタァライト九九組【愛城華恋(CV:小山百代)、神楽ひかり(CV:三森すずこ)、天堂真矢(CV:富田麻帆)、星見純那(CV:佐藤日向)、露崎まひる(CV:岩田陽葵)、大場なな(CV:小泉萌香)、西條クロディーヌ(CV:相羽あいな)、石動双葉(CV:生田輝)、花柳香子(CV:伊藤彩沙)】,"￥ 2,700",石井健太郎 / 中村康隆 / 藤澤慶昌 / 小高光太郎 / UiNA / 大川茂伸 / 尋木ヒロ,36 分,ポニーキャニオン,石井健太郎 / 藤澤慶昌 / 加藤達也 / 小高光太郎 / 藤井亮太 / 谷ナオキ / 伊藤賢 / 尋木ヒロ,中村彼方,,,「少女☆歌劇 レヴュースタァライト」劇中歌アルバムVol.1「ラ レヴュー ド マチネ」,,,,,,,,,,,,,,,,,,,,,,,,
154600,OST Novectacle 同人 ファタモルガーナの館 绝美 galgame 2013 AVG,9.014,69,"['19', '38', '8', '2', '2', '0', '0', '0', '0', '0']",ファタモルガーナの館 オリジナルサウンドトラック,2017-08-11(新装版),4,,2000 JPY(新装版),,270 m,,,,ost,,THE HOUSE IN FATA MORGANA ORIGINAL SOUND TRACKS,,,,,,,,,,,,,,,,,,,,,,,,
1785,OST 大谷幸 灰羽联盟 治愈 2002 畑亜貴 Heart_of_Air 演奏 アニメ 动漫原声带 DONNA_BURKE anime 民族调 治癒 new-age 已经购入 ； Julianne album TV 收盘神作 只怪你过于美好,8.825,154,"['44', '52', '47', '10', '0', '1', '0', '0', '0', '0']",灰羽連盟 サウンドトラック ハネノネ,2002年12月21日,1,,"￥ 1,277",大谷幸,52分钟,,,,Soundtrack,Geneon [Pioneer],,Geneon [Pioneer],,,,,,,,,,,,,,,,,,,,,,,
243161,OST 西木康智 RPG 2018 西木康志 GAME 冒险 游戏音乐 好旋律 优美,9.033,60,"['17', '29', '13', '1', '0', '0', '0', '0', '0', '0']",OCTOPATH TRAVELER Original Soundtrack,2018-07-13,4,,"¥4,104（税込）",西木康智,,Square Enix Music,西木康智,,,,,,,,,,,,,,,,,,,,,,,,,,,,
148013,神前晓 OST 物语系列 OP 2016 ED 歌物语 堀江由衣 沢城みゆき 花澤香菜 喜多村英梨 Collection 神前暁 ryo Aniplex 动画 田中秀和 春奈るな anime 加藤英美里 やなぎなぎ 斎藤千和 ClariS 2017 V.A. 十星 动画歌曲 已入 DSD megrock,8.754,256,"['52', '109', '78', '15', '1', '1', '0', '0', '0', '0']",歌物語  -〈物語〉シリーズ主題歌集-,2016-01-06,3,斎藤千和 / 加藤英美里 / 沢城みゆき / 花澤香菜 / 堀江由衣 / やなぎなぎ / 喜多村英梨 / 井口裕香 / ClariS / 河野マリナ(河野万里奈) / 春奈るな / 三木眞一郎,"￥4,298",神前暁 / ryo / じん / ミト / 黒須克彦 / 田中秀和,101 m,Aniplex,神前暁 / ryo / 高田龍一 / じん / 中西亮輔 / ミト / 鈴木Daichi秀行 / 田中秀和,meg rock / ryo / こだまさおり / じん,CD+BD/DVD,,,,歌物语 物语系列主题歌集,,,,,,,,,,,,,,,,http://www.monogatari-series.com/utamonogatari,,,,,,
3668,OST 菅野よう子 菅野洋子 攻壳机动队SAC 攻殻機動隊 攻壳机动队 2004 anime ORIGA OP 日本 ED 攻壳 流行 Scott_Matthew 動畫OST Emily_Curtis I_do Shanti_Snyder Jillmax VICTOR 电子 摇滚 动画 TV steve_conte New_Age Ilaria_Graziano O.S.T.,8.783,198,"['46', '89', '51', '9', '0', '1', '0', '0', '0', '2']",攻殻機動隊 STAND ALONE COMPLEX O.S.T.2,2004-05-26,1,菅野よう子 / Origa / Ilaria Graziano / Jillmax / Scott Matthew / Emily Curtis / Steve Conte and Shanti Snyder,"￥ 3,045",菅野よう子,65 分,ビクターエンタテインメント,,菅野よう子 / Tim Jensen / Ilaria Graziano / Shanti Snyder,Soundtrack,Victor Studio / Soundcity Studio / Soundtrack Studio (NYC) / Manhattan Center Studios (NYC),GHOST IN THE SHELL STAND ALONE COMPLEX O.S.T.2,ビクターエンタテインメント,,,菅野よう子,,,,,,,,,,,,,,,,,,,,
33674,椎名林檎 JPOP 日本 井上雨迩 2008 Virgin_Music MA EMI 森俊之,9.200,40,"['22', '10', '6', '1', '0', '0', '0', '1', '0', '0']",加爾基 精液 栗ノ花,2008-07-02,,椎名林檎,"￥ 3,059",,45 m,,,,,EMIミュージック・ジャパン,,EMIミュージック・ジャパン,,,,,,,,,,,,,,,,,,,,,,,
7414,OST 樋口秀樹 galgame 和风 纯音乐 きっと、澄みわたる朝色よりも、音楽集 樋口秀树 神曲 GAL きっと、澄みわたる朝色よりも white-lips ACG 2009 ED ゲーム ADV OP,8.825,126,"['42', '42', '25', '12', '5', '0', '0', '0', '0', '0']",きっと、澄みわたる朝色よりも、音楽集,2009/11/25,,Tynwald music、WHITE-LIPS,,樋口秀樹,,,,,CD,,,,,,,,,,,,,,,,,,,,,,,,,,
39206,OST leaf 上原れな WA2 白色相簿2 galgame 津田朱里 2012 ACG 原声 GAME V.A. OP 小木曾雪菜 lea 游戏 IC cd 2012年 中上和英 下川直哉 白学 冬季音乐 上原玲奈 实体盘 松岡純也 白色相簿 神曲 WHITEALBUM white_album,8.728,305,"['80', '112', '77', '29', '4', '2', '0', '0', '0', '1']",WHITE ALBUM2 ORIGINAL SOUNDTRACK ～introductory～,2012-04-27,2,上原れな,"￥ 2,100",,1:41:38.040,アクアプラス,,須谷尚子,CD-ROM,アクアプラス,,,,,,,,,,,,,,,,,,,,,,,,,
3550,菅野洋子 OST 菅野よう子 高达 1997 ∀ガンダム 神作 Moon anime 西城秀树 胡子大好 ROBO 补 动漫原声带 日本 機動戦士ガンダム 西条秀樹 岩坂士京,8.904,83,"['23', '35', '20', '4', '1', '0', '0', '0', '0', '0']",∀ガンダム ORIGINAL SOUND TRACKS,1997-07-23,1,ホワイトドールの祭りの会一同、Gabriela Robin(菅野よう子)、西城秀樹、岩坂士京、Warsaw Philharmonic Orchestra,,菅野よう子、小林亜星,,,菅野よう子,Gabriela Robin(菅野よう子)、井荻麟(富野由悠季)、岩里祐穂,OST,,ターンAガンダム Original Soundtracks,,Turn A 高达 OST,,,,,,,,,,,,,,,,,,,,,,
270757,key 交响乐 麻枝准 管弦乐 2018 感动 折戸伸治 PMMK 井内舞子 戸越まごめ Arrangement SYMPHONY,9.444,27,"['15', '9', '3', '0', '0', '0', '0', '0', '0', '0']",Key ORCHESTRA CONCERT 2018,2018/9/24,2,,"4,000円 (税込)",折戸伸治、麻枝准、戸越まごめ、PMMK、井内舞子,1hr 41min,,竹岡智行、辻田絢菜、鹿野草平、堀田庸元、直江香世子、木村裕、水月陵,,,,,,,,馬場隆博,,,,志村健一,,"梶田法子, 水月陵",Ryuta,待山一生,Meine Meinung,東京混声合唱団,東京室内管弦楽団,"竹岡智行, 辻田絢菜, 鹿野草平, 堀田庸元, 直江香世子, 木村裕, 水月陵",折戸伸治,,,,,,,
1541,ef 天门 悠久之翼 OST 天門 柳英一郎 GAL galgame 原田ひとみ 音乐 2009 日本 ゲーム 2008 治愈 催泪神曲 AVG 游戏原声,8.735,275,"['68', '98', '85', '17', '6', '1', '0', '0', '0', '0']",ef - a fairy tale of the two. Original Soundtrack. Alato,2008-12-28（C75）,3,原田ひとみ,￥3999,天門、柳英一郎,,,,,,,,,,,,,,,,SW-049,,,,,,,,,,,,,,,
8104,吉卜力 剧场版主题曲 手嶌葵 ED GHIBLI 本名陽子 安田成美 CHAGE&ASKA 井上あずみ 坂本洋子 アニメ anime 都はるみ 上々颱風 米良美一 松任谷由実 久石让 动画 和风 OST 加藤登紀子 静心 2001,9.037,54,"['14', '29', '10', '1', '0', '0', '0', '0', '0', '0']",スタジオジブリの歌,2008-11-26,2,安田成美、井上あずみ、アメリータ・ガリ＝クルチ(Amelita Galli-Curci)、荒井由実(松任谷由実)、都はるみ、加藤登紀子、坂本洋子、上々颱風、本名陽子、CHAGE&ASKA、米良美一、山田家の人々（朝丘雪路、益岡徹、荒木雅子、五十畑迅人、宇野なおみ）、藤原先生（矢野顕子）、木村弓、つじあやの、Tina(柚木ちな)、倍賞千恵子、手嶌葵、林正子、藤岡藤巻と大橋のぞみ,"￥ 3,500",細野晴臣、久石譲、Henry Rowley Bishop、荒井由実(松任谷由実)、Amanda McBroom、Antoine Aime Renard、加藤登紀子、永田茂、猪野陽子、紅龍、Bill Danoff、Taffy Nivert、John Denver、飛鳥涼(ASKA)、Jay Livingston、Ray Evans、矢野顕子、木村弓、つじあやの、Vincent Ford、谷山浩子、新居昭乃、保刈久明,104 m,徳間ジャパンコミュニケーションズ,萩田光雄(萩田光男)、富澤裕、久石譲、松任谷正隆、星勝、菅野よう子、大口純一郎、永田茂、上々颱風、古澤良治郎、野見祐二、澤近泰輔、斉藤ネコ、Jeff Bova、矢野顕子、木村弓、根岸孝旨、山本拓夫、寺嶋民哉,松本隆、宮崎駿、中川李枝子、John Howard Payne、荒井由実(松任谷由実)、Amanda McBroom、高畑勲、Jean-Baptiste Clément、加藤登紀子、望月智充、紅龍、Bill Danoff、Taffy Nivert、John Denver、鈴木麻実子、飛鳥涼(ASKA)、Jay Livingston、Ray Evans、矢野顕子、覚和歌子、つじあやの、谷川俊太郎、宮崎吾朗、新居昭乃、近藤勝也,,"Tokuma Japan Communications CO.,LTD(TK)(M)",,"Tokuma Japan Communications CO.,LTD(TK)(M)",吉卜力映画主题歌集,,,,,STUDIO GHIBLI SONGS,,,,,,,,,,,,,,,,,
12649,OST 缘之空 三轮学 2011 原声集 三輪学 galgame anime 动画 无话可说 大制作宣传片 アニメ 纯音 致郁 依媛奈緒 BrunoWen-li 神曲 神作 TV,8.745,204,"['51', '85', '48', '16', '1', '1', '0', '0', '0', '2']",ヨスガノソラ オリジナルサウンドトラック－New－,2011-02-23,1,,,Bruno Wen-li(市川淳),,キングレコード,Bruno Wen-li(市川淳),,BD-ROM,,ヨスガノソラ Blu-ray 依媛奈緒 封入特典CD,,缘之空BD附限定原声集,,,,,,,,,,,,,,,,,,,,,,
9285,目黒将司 OST PERSONA ATLUS ペルソナ 目黑将司 ペルソナ3 VGM 补 2006 O.S.T.,8.857,98,"['33', '34', '23', '5', '2', '0', '0', '0', '0', '1']",PERSONA3 Original Soundtrack,2006-07-31,2,目黒将司,"￥ 3,045",目黒将司,130min,Sony Music Associated Records、ソニー・ミュージックディストリビューション,目黒将司,,Soundtrack / Import,アニプレックス、Aniplex,Persona 3 Original Soundtrack,Sony,女神异闻录3 OST,,,,,,,,,,,,,,,,,,,,,,
